{
  "title": "城市最后一班电车",
  "total_duration": 15,
  "tone": "温暖治愈，带一点城市深夜的静谧",
  "characters": [
    {
      "name": "阿澈",
      "appearance": "二十岁出头，深色短发，浅灰卫衣，背着旧帆布包，笑起来眼角有痣",
      "personality": "安静内向，观察力强，习惯用文字记录心情",
      "speech_style": "语速慢，句子短，偶尔带着自嘲式的幽默",
      "taboos": "不做夸张表情，不出现手机屏幕反光"
    },
    {
      "name": "小雨",
      "appearance": "同样年轻，黑色长发扎成低马尾，米色风衣，围着红色围巾",
      "personality": "外向温和，善于倾听，容易共情",
      "speech_style": "语气轻快，喜欢用问句拉近距离",
      "taboos": "不出现流泪镜头特写"
    }
  ],
  "shots": [
    {
      "index": 1,
      "duration": 5,
      "scene": "深夜空荡的电车车厢，暖黄色灯光，车窗外的城市灯火向后掠过",
      "action": "从车门方向缓慢推近至阿澈侧脸",
      "mood": "安静、孤独中带着期待",
      "visual": "暖黄色车厢内景，深色短发青年靠窗而坐，浅灰卫衣，旧帆布包放在膝上，车窗玻璃映出流动的城市灯光，侧脸轮廓被暖光勾边",
      "narration": "这座城市睡着以后，还有一班车，载着没睡的人。",
      "first_frame_ref": "char/阿澈_定妆.png",
      "last_frame_ref": "无",
      "sound": "轻柔钢琴 BGM，电车低鸣环境音"
    },
    {
      "index": 2,
      "duration": 5,
      "scene": "同一车厢，镜头转向对面座位",
      "action": "横移，从阿澈视线方向滑向对面坐着的女孩",
      "mood": "好奇、微妙的相遇感",
      "visual": "对面座位坐着黑色低马尾、米色风衣、红围巾的女孩，正低头翻一本书，头顶暖黄顶灯，周围乘客稀少，构图留出车窗外的夜景",
      "narration": "直到我注意到，对面那个一直翻书的人，也还没下车。",
      "first_frame_ref": "char/小雨_定妆.png",
      "last_frame_ref": "无",
      "sound": "钢琴旋律渐强，翻书页的轻响"
    },
    {
      "index": 3,
      "duration": 5,
      "scene": "电车到站，两人先后起身走向车门",
      "action": "跟拍两人背影，出车门后镜头定格在站台灯光下",
      "mood": "释然、温暖",
      "visual": "两人一前一后下车，站台暖色灯光洒在肩上，回头相视一笑，镜头拉远定格在站牌与远去的电车尾部灯光",
      "narration": "也许，这座城市不是没人醒着——是醒着的人，刚好坐上了同一班车。",
      "first_frame_ref": "无",
      "last_frame_ref": "char/阿澈_定妆.png",
      "sound": "钢琴收束，电车关门提示音，站台环境音渐弱"
    }
  ]
}
